{
  "version": "1.0.0",
  "lastUpdated": "2026-08-31",
  "schema": "../schemas/assessment-option.schema.json",
  "description": "Reusable option-set catalogue for the Career Finder. Option IDs are stable identifiers. Government, state, qualification and category identifiers should correspond to the canonical common-data registries.",
  "optionSets": [
    {
      "id": "assessment_goal",
      "label": {
        "en": "Assessment Goal",
        "bn": "মূল উদ্দেশ্য"
      },
      "options": [
        {
          "id": "find_best_career",
          "label": {
            "en": "Find the government career that best fits me",
            "bn": "আমার সঙ্গে সবচেয়ে মানানসই সরকারি ক্যারিয়ার খুঁজতে চাই"
          },
          "value": "FIND_BEST_CAREER"
        },
        {
          "id": "compare_careers",
          "label": {
            "en": "Compare government careers",
            "bn": "সরকারি ক্যারিয়ারগুলির তুলনা করতে চাই"
          },
          "value": "COMPARE_CAREERS"
        },
        {
          "id": "check_eligibility",
          "label": {
            "en": "Check where I am eligible",
            "bn": "কোন চাকরিতে আমি যোগ্য তা জানতে চাই"
          },
          "value": "CHECK_ELIGIBILITY"
        },
        {
          "id": "explore_salary",
          "label": {
            "en": "Explore salary and benefits",
            "bn": "বেতন ও সুবিধা জানতে চাই"
          },
          "value": "EXPLORE_SALARY"
        },
        {
          "id": "explore_family_fit",
          "label": {
            "en": "Find careers compatible with family life",
            "bn": "পরিবারের সঙ্গে মানানসই ক্যারিয়ার খুঁজতে চাই"
          },
          "value": "EXPLORE_FAMILY_FIT"
        }
      ]
    },
    {
      "id": "education_level",
      "label": {
        "en": "Highest Education Level",
        "bn": "সর্বোচ্চ শিক্ষাগত স্তর"
      },
      "options": [
        {
          "id": "class_8",
          "label": {
            "en": "Class 8",
            "bn": "অষ্টম শ্রেণি"
          },
          "value": "CLASS_8"
        },
        {
          "id": "class_10",
          "label": {
            "en": "Class 10 / Secondary",
            "bn": "দশম শ্রেণি / মাধ্যমিক"
          },
          "value": "CLASS_10"
        },
        {
          "id": "class_12",
          "label": {
            "en": "Class 12 / Higher Secondary",
            "bn": "দ্বাদশ শ্রেণি / উচ্চমাধ্যমিক"
          },
          "value": "CLASS_12"
        },
        {
          "id": "iti",
          "label": {
            "en": "Industrial Training Institute (ITI)",
            "bn": "ইন্ডাস্ট্রিয়াল ট্রেনিং ইনস্টিটিউট (ITI)"
          },
          "value": "ITI"
        },
        {
          "id": "diploma",
          "label": {
            "en": "Diploma",
            "bn": "ডিপ্লোমা"
          },
          "value": "DIPLOMA"
        },
        {
          "id": "graduate",
          "label": {
            "en": "Graduate",
            "bn": "স্নাতক"
          },
          "value": "GRADUATE"
        },
        {
          "id": "postgraduate",
          "label": {
            "en": "Postgraduate",
            "bn": "স্নাতকোত্তর"
          },
          "value": "POSTGRADUATE"
        },
        {
          "id": "doctorate",
          "label": {
            "en": "Doctorate",
            "bn": "ডক্টরেট"
          },
          "value": "DOCTORATE"
        }
      ]
    },
    {
      "id": "academic_qualification_type",
      "label": {
        "en": "Main Academic Qualification",
        "bn": "প্রধান শিক্ষাগত যোগ্যতা"
      },
      "options": [
        {
          "id": "secondary",
          "label": {
            "en": "Secondary / Class 10",
            "bn": "মাধ্যমিক / দশম শ্রেণি"
          },
          "value": "SECONDARY"
        },
        {
          "id": "higher_secondary",
          "label": {
            "en": "Higher Secondary / Class 12",
            "bn": "উচ্চমাধ্যমিক / দ্বাদশ শ্রেণি"
          },
          "value": "HIGHER_SECONDARY"
        },
        {
          "id": "ba",
          "label": {
            "en": "Bachelor of Arts",
            "bn": "ব্যাচেলর অফ আর্টস"
          },
          "value": "BA"
        },
        {
          "id": "bsc",
          "label": {
            "en": "Bachelor of Science",
            "bn": "ব্যাচেলর অফ সায়েন্স"
          },
          "value": "BSC"
        },
        {
          "id": "bcom",
          "label": {
            "en": "Bachelor of Commerce",
            "bn": "ব্যাচেলর অফ কমার্স"
          },
          "value": "BCOM"
        },
        {
          "id": "bba",
          "label": {
            "en": "Bachelor of Business Administration",
            "bn": "ব্যাচেলর অফ বিজনেস অ্যাডমিনিস্ট্রেশন"
          },
          "value": "BBA"
        },
        {
          "id": "bca",
          "label": {
            "en": "Bachelor of Computer Applications",
            "bn": "ব্যাচেলর অফ কম্পিউটার অ্যাপ্লিকেশনস"
          },
          "value": "BCA"
        },
        {
          "id": "btech",
          "label": {
            "en": "Bachelor of Technology",
            "bn": "ব্যাচেলর অফ টেকনোলজি"
          },
          "value": "BTECH"
        },
        {
          "id": "be",
          "label": {
            "en": "Bachelor of Engineering",
            "bn": "ব্যাচেলর অফ ইঞ্জিনিয়ারিং"
          },
          "value": "BE"
        },
        {
          "id": "llb",
          "label": {
            "en": "Bachelor of Laws",
            "bn": "ব্যাচেলর অফ লজ"
          },
          "value": "LLB"
        },
        {
          "id": "ba_hons",
          "label": {
            "en": "Bachelor of Arts with Honours",
            "bn": "ব্যাচেলর অফ আর্টস অনার্স"
          },
          "value": "BA_HONS"
        },
        {
          "id": "ma",
          "label": {
            "en": "Master of Arts",
            "bn": "মাস্টার অফ আর্টস"
          },
          "value": "MA"
        },
        {
          "id": "msc",
          "label": {
            "en": "Master of Science",
            "bn": "মাস্টার অফ সায়েন্স"
          },
          "value": "MSC"
        },
        {
          "id": "mcom",
          "label": {
            "en": "Master of Commerce",
            "bn": "মাস্টার অফ কমার্স"
          },
          "value": "MCOM"
        },
        {
          "id": "mba",
          "label": {
            "en": "Master of Business Administration",
            "bn": "মাস্টার অফ বিজনেস অ্যাডমিনিস্ট্রেশন"
          },
          "value": "MBA"
        },
        {
          "id": "mca",
          "label": {
            "en": "Master of Computer Applications",
            "bn": "মাস্টার অফ কম্পিউটার অ্যাপ্লিকেশনস"
          },
          "value": "MCA"
        }
      ]
    },
    {
      "id": "academic_subjects",
      "label": {
        "en": "Academic Subjects",
        "bn": "শিক্ষাগত বিষয়"
      },
      "options": [
        {
          "id": "english",
          "label": {
            "en": "English",
            "bn": "ইংরেজি"
          },
          "value": "ENGLISH"
        },
        {
          "id": "bengali",
          "label": {
            "en": "Bengali",
            "bn": "বাংলা"
          },
          "value": "BENGALI"
        },
        {
          "id": "hindi",
          "label": {
            "en": "Hindi",
            "bn": "হিন্দি"
          },
          "value": "HINDI"
        },
        {
          "id": "history",
          "label": {
            "en": "History",
            "bn": "ইতিহাস"
          },
          "value": "HISTORY"
        },
        {
          "id": "geography",
          "label": {
            "en": "Geography",
            "bn": "ভূগোল"
          },
          "value": "GEOGRAPHY"
        },
        {
          "id": "political_science",
          "label": {
            "en": "Political Science",
            "bn": "রাষ্ট্রবিজ্ঞান"
          },
          "value": "POLITICAL_SCIENCE"
        },
        {
          "id": "economics",
          "label": {
            "en": "Economics",
            "bn": "অর্থনীতি"
          },
          "value": "ECONOMICS"
        },
        {
          "id": "mathematics",
          "label": {
            "en": "Mathematics",
            "bn": "গণিত"
          },
          "value": "MATHEMATICS"
        },
        {
          "id": "statistics",
          "label": {
            "en": "Statistics",
            "bn": "পরিসংখ্যান"
          },
          "value": "STATISTICS"
        },
        {
          "id": "commerce",
          "label": {
            "en": "Commerce",
            "bn": "বাণিজ্য"
          },
          "value": "COMMERCE"
        },
        {
          "id": "accounting",
          "label": {
            "en": "Accounting",
            "bn": "হিসাববিজ্ঞান"
          },
          "value": "ACCOUNTING"
        },
        {
          "id": "physics",
          "label": {
            "en": "Physics",
            "bn": "পদার্থবিদ্যা"
          },
          "value": "PHYSICS"
        },
        {
          "id": "chemistry",
          "label": {
            "en": "Chemistry",
            "bn": "রসায়ন"
          },
          "value": "CHEMISTRY"
        },
        {
          "id": "biology",
          "label": {
            "en": "Biology",
            "bn": "জীববিজ্ঞান"
          },
          "value": "BIOLOGY"
        },
        {
          "id": "computer_science",
          "label": {
            "en": "Computer Science",
            "bn": "কম্পিউটার সায়েন্স"
          },
          "value": "COMPUTER_SCIENCE"
        },
        {
          "id": "information_technology",
          "label": {
            "en": "Information Technology",
            "bn": "তথ্যপ্রযুক্তি"
          },
          "value": "INFORMATION_TECHNOLOGY"
        },
        {
          "id": "psychology",
          "label": {
            "en": "Psychology",
            "bn": "মনোবিজ্ঞান"
          },
          "value": "PSYCHOLOGY"
        },
        {
          "id": "education",
          "label": {